,FN_text,FN_index
0,espn curious if you have ever considered playing fantasy football,20924
1,cocky attempt to operate atm in spanish backfires,17972
2,cricket located,19657
3,state bird reconsidered after latest wren attack,16079
4,obama under fire for playing t-ball during vietnam,26999
5,johns hopkins doctors perform first successful surgery on broken thumb,52431
6,de blasio courts iowa voters by winning 'largest candidate' at polk county fair,31199
7,48 syrian civilians massacred during claire danes' emmy award acceptance speech,26686
8,5-year-old alabama boy misses fun 'bunker grandpa',40676
9,conservative acquaintance annoyingly not racist,10880
10,"'fear not—she means you no harm,' says elizabeth warren, revealing docile hillary clinton to crowd",45082
11,inside: the fetish photography of german chancellor helmut kohl,23091
12,$30 million donation from chan-zuckerberg charity to help kids learn to read returned,32048
13,boss's clout evaporates after he's seen in shorts at company picnic,7790
14,alabama forced to release thousands of sex offenders after inmates deny charges,33938
15,rnc taps dennis hastert to lead new youth outreach program,27026
16,compassionate fisherman doesn't have heart to throw trout back into incredibly polluted lake,50991
17,cannon overshoots tim kaine across wells fargo center,25474
18,tupperware will never truly recover from red curry leftovers,65
19,"'becoming a mother has been the most thrilling experience of my life,' reports woman fleeing hospital with stolen baby",48986
20,puerto rico celebrates dependence day,54211
21,300 million without electricity in india after restoration of power grid,3480
22,new 'star wars' film once again disappoints die-hard nien nunb fans,32737
23,g20 leaders attend saudi crown prince's informative seminar on eliminating dissident journalists,38633
24,clinton 'very disappointed' in missouri,45879
25,unbeatable 'jeopardy!' champ says key to success is threatening other contestants with nail-studded baseball bat during commercials,51383
26,the arts: what were they?,43348
27,john boehner calls for national guard to deal with illegal immigrants hiding in mexico,8678
28,gerbil running late will have to eat her babies on the go,54391
29,280 days of meryl streep's year spent being honored,45020
30,christianity celebrates one billionth unanswered prayer,45114
31,nbc on olympics coverage: 'sorry we didn't alter the laws of space and time to accommodate people's schedules',18079
32,clinton hitchhikes to st. louis for jazzfest,49391
33,everyone in pride parade straight,53422
34,l.a. grants clippers $12 for new nets,49282
35,winter storm threatens homeless man's plans to survive over thanksgiving,53167
36,church member not the same since unsuccessful choir tryout,18180
37,mario batali reduced to selling bowl of ravioli on craigslist,30310
38,real-life nancy drew traces source of her hpv,52133
39,gop officials: kavanaugh shouldn't be held accountable for something he did as white teenager,35357
40,need for more places to sit becomes election's most important issue,35606
41,trump revokes puerto rico recovery funds after learning hurricane maria had fewer survivors,42337
42,fans of victorious nobel laureates riot in stockholm,43404
43,12-year-old who got her hair curled for spring dance the very image of old hollywood glamour,38169
44,a&e biography host peter graves comes out in ellen-inspired ratings grab,9618
45,uber offering discounted wages for election day,38408
46,pope francis donates clothing to needy refugees,34724
47,ray-ban a little unsure public can pull off 2012 series of sunglasses,24745
48,"honest, hardworking man leans against reliable pickup truck",23845
49,least corrupt politician in illinois history sentenced to 14 years in prison,26043
50,gerbil running late will have to eat her babies on the go,22260
51,"scott bakula turns 43, newspaper reports",47917
52,beautiful spring day no match for last 35 years of man's life,39729
53,"cameraman strikes gold with tubby fan eating ice cream, dancing, holding baby",47291
54,jeremy piven outraged microsoft word doesn't recognize his name,35011
55,600-pound butter cow sculpture wins iowa caucus,27010
56,open casket really ruining vibe at funeral,10014
57,mama duck doesn't recall asking for injured baby to be rescued from road,49066
58,is your privacy being violated? an exclusive hidden-camera investigation,26123
59,pacific ocean quarantined after contact with carnival cruise ship,17077
60,woman injured in hostile makeover,41141
61,peaceful protest interrupted by swarm of aggressive black-clad militants,23834
62,47 weak-willed senators bend to interests of powerful american people,44068
63,supporters aggravated bernie sanders didn't use dnc speech to get voters to act against their own self-interest,36620
64,5 states to decide whether to legalize marijuana or continue honoring god,25701
65,john boehner calls for national guard to deal with illegal immigrants hiding in mexico,35405
66,gop warns refugees likely to be driven to terrorism by way america would treat them,35162
67,winter storm threatens homeless man's plans to survive over thanksgiving,26169
68,wildfires force colorado to airlift rocky mountains to safety,4373
69,giuliani puts odds of trump-mueller interview at 50-65,30318
70,fabled lost city of gold finally discovered off i-95 outside baltimore,46710
71,"rick perry speech electrifies 1,200 scared, miserable racists",35563
72,'rock the vote' propels metallica to senate,3027
73,anonymous source: 'i'm a cowardly snitch',8317
74,"larry nassar: 'who among us hasn't made a mistake repeatedly and with wild, shameless abandon?'",5290
75,veteran told what offends him,21163
76,catherine zeta-jones happy to see people on internet would still hit that,4727
77,report: one in five women training to be yoga instructors,10868
78,"russian interference had no impact on election, reports website created 8 minutes ago",12057
79,progressive charter school doesn't have students,24451
80,no one in group admits girls' night out a colossal failure,16082
81,dan quayle on standby to take over as bush family patriarch after george h.w. admitted to icu,52421
82,"aol/time warner turmoil over-reported, says time",38460
83,extension cord on stage steals spotlight from jeb bush during campaign rally,43316
84,panic floods mike pence's system before realizing hand on knee his own,29244
85,boilermakers protest purdue's mascot,26136
86,woman injured in hostile makeover,8408
87,congolese rebel can't bring himself to care about congolese war,35371
88,"word 'innovate' said 650,000 times at sxsw so far",30414
89,mike pompeo defects to north korea after learning about kim jong-un's torture program,41233
90,'new york times' rehires judith miller to cover escalating iran tensions,31832
91,dad's been on a parenting kick lately,5378
92,families of missing flight passengers just hoping media gets closure it needs,26772
93,supreme court issues 7-1 decision to find scalia's killer,50256
94,hollywood's biggest stars endure long lines at oscars security screening,21017
95,louvre curators hurry to display ugly van gogh donor gave them before surprise visit,38260
96,george jefferson honored for black television history month,36267
97,some guy who's not stephen colbert to deliver college's commencement speech,16293
98,dean cain fanpage last updated 8/14/96,37563
99,"after careful thought, teen applies to college where family donated building",35943
100,son attempts to cultivate parents' interest in better movies,38912
101,"brilliant, innovative ceo just wrote words 'social media' on whiteboard and underlined it",26900
102,golden retriever mauls 5 in huge victory for pitbull apologists,50067
103,"aol/time warner turmoil over-reported, says time",24978
104,florida passes strict ban on being unarmed,49038
105,senatorial candidate challenges opponent to drop out of race,27278
106,united airlines updates policy on allowing dogfights in passenger cabin,55150
107,jay leno reconsiders retirement after georgia woman sets boyfriend's crotch on fire,28396
108,exasperated huckabee sanders reminds press corps that children under 14 can't feel pain,26860
109,the media: are they media-obsessed?,4803
110,jeremy piven outraged microsoft word doesn't recognize his name,26140
111,"'captain actual america' overweight, hopelessly in debt",12729
112,senate rejects pipeline plan that would have created thousands of climate activist jobs,29910
113,man with 20 rifles can't remember if his goal to start or stop violent overthrow of government,17400
114,furloughed bison pour back into national parks after government reopens,35769
115,u.s. adds 4 million jobs but in st. louis,18949
116,charlottesville suspect might have received tacit support from high-level government figure,29455
117,report: countless invasive species detained in epa black sites,35823
118,third knocked-over glass of water makes man want to give up,43387
119,afterbirthers demand to see obama's placenta,32422
120,"music playing in bar could stand to be louder, worse",14409
121,local radio station has got some doobie brothers coming up for you,43219
122,"obama's record-breaking fundraising effort bankrupting npr, world wildlife fund, aclu",11692
123,rwandan refugees angered over lack of aol access,3260
124,chevron touts green initiative with hybrid-powered oil drilling platforms,9461
125,koch brothers encouraging youth to make voices heard by registering super pac,37032
126,your dog died,25545
127,johns hopkins doctors perform first successful surgery on broken thumb,8477
128,heavy police presence in ferguson to ensure residents adequately provoked,38352
129,loophole in curse lets archaeologist off the hook,15340
130,first day of school photos a chance to see how much cousin's kids are chunking out this year,32730
131,"pope benedict leaves church in helicopter with lebron james, paul feig for some reason",9998
132,man in international airport only speaks business,23151
133,"mainstream media at it again, bloggers report",53962
134,sean spicer walking around white house in sunglasses and baseball cap to avoid press,43876
135,parents of adorable baby on tv show most likely insane,37950
136,sanders supporters viciously attack bernie sanders after he criticizes mistakes of 2016 sanders campaign,43190
137,grasshopper dismembered by future supreme court justice,22681
138,single fat kid takes 50 years off jungle gym's life,4735
139,"'fear not—she means you no harm,' says elizabeth warren, revealing docile hillary clinton to crowd",19026
140,focus groups hated it right up until guy's head got cut off,25550
141,congress splits into male and female senators to discuss newest reproductive bill,35126
142,"they might be giants behind the music episode lacks sex, drugs",43062
143,pope francis pardons those who dodged the draft during crusades,4771
144,obama turns 50 despite republican opposition,4712
145,"man who will pay $60,000 in medical bills this year can't afford health insurance right now",40432
146,nobody in ukraine notices absence of government,44772
147,cleveland indians owner admits chief wahoo no longer compatible with modern revenue growth expectations,34648
148,senatorial candidate challenges opponent to drop out of race,10710
149,"mike pence criticizes venezuela's use of torture, starvation on non-homosexual citizens",41013
150,girl in park acts like it's no big deal she's wearing bikini,20673
151,"trump, putin hold first joint press crackdown",43579
152,ann coulter attacks trump for cowardly backing down from full on race war,52955
153,morning after morning after pill re-impregnates guilt-ridden women,1512
154,voters shocked christie botched such an easy political cover-up,451
155,"convict sentenced to generating $80,000 to $100,000 in profits for private prison",39879
156,report: one in five women training to be yoga instructors,30992
157,"they might be giants behind the music episode lacks sex, drugs",2668
158,unclear if fountain is the type you're allowed to run around in,31323
159,280 days of meryl streep's year spent being honored,2411
160,john boehner beheads juarez cartel member who dared muscle in on his legal weed turf,46804
161,compassionate trump issues full presidential pardon for robert mueller,37714
162,inside: the fetish photography of german chancellor helmut kohl,28256
163,l.a. grants clippers $12 for new nets,106
164,afterbirthers demand to see obama's placenta,26393
165,roy moore refusing to withdraw from alabama 13-year-old,1105
166,sesame street mourns death of original letter k,26516
167,americans hopeful this will be last mass shooting before they stop on their own for no reason,32814
168,alpha trick-or-treater established by third house,19349
169,louvre curators hurry to display ugly van gogh donor gave them before surprise visit,6504
170,senators wish domenici would bring dog to work more often,16184
171,kendrick lamar deletes 'rhymezone.com' from internet history,43050
172,thieves make off with museum's most valuable docents,16087
173,trump fulfills campaign promise of pushing major immigration decision on someone else so he can watch tv,837
174,katie couric winces at word 'vagina',54209
175,former chinese dissident has your order ready,53234
176,bangladesh runs out of people,29014
177,progressive charter school doesn't have students,39997
178,climate scientists confirm there's still time to blow up the earth,33066
179,fbi shuts down prominent new isis recruitment website,26964
180,ivana trump calls ex-husband to ask him what he did to her beautiful baby boy,53005
181,drew carey signs 75-year contract to host the price is right,35975
182,irish-americans gear up for 'the reinforcin' o' the stereotypes',26653
183,300 million without electricity in india after restoration of power grid,43865
184,tic-tac-toe grandmaster devises brilliant new gambit,34852
185,$14.5 billion pledged to rebuild battleground states,14426
186,airbnb user loves how easy website makes it to ejaculate in stranger's sink,21011
187,"'cooking together is so fun,' says man correcting girlfriend's every knife cut",33904
188,experts: ebola vaccine at least 50 white people away,13486
189,little debbie conquers jenny craig in midnight showdown,24123
190,orphanage director pushing asian orphans,22872
191,football fan wears off-season body paint,8953
192,fly on wall can't believe they're restructuring entire west coast division,22155
193,'rock the vote' propels metallica to senate,49709
194,loose-cannon cop who doesn't play by the rules uses unconventional filing system for paperwork while on desk duty,29580
195,ambassador holding phrasebook 'pretty sure' she just strengthened ties with pakistan,51557
196,new 'star wars' film once again disappoints die-hard nien nunb fans,55
197,anthropologists discover ancient greek super pac that helped shape first democracy,16580
198,god shoots himself while cleaning gun,27647
199,experts: ebola vaccine at least 50 white people away,52631
200,plows working around clock to keep new hampshire roads clear of campaign signs,38031
201,outbreak of va-va-vooms traced to miniskirt-wearing blonde,728
202,ryan chugs down rhino horn and bull semen shake for mid-debate boost,39778
203,mcdonald's fights world hunger with new triple-decker burger,29489
204,confused marines capture al-jazeera leader,37931
205,supreme court votes 7-2 to legalize all worldly vices,15889
206,grumblethor the mischievous pleased with mayhem his magical antics have wrought upon white house–fbi relations,1414
207,"ugh, this a place where bartenders wear bow tie",52024
208,sex scandal sinks klemke reelection bid,48290
209,7.1 billion demonstrate in favor of global warming,8135
210,americans take brief break from waiting on hold with insurance providers to celebrate obamacare ruling,6347
211,baby doesn't realize it's a white supremacist yet,33749
212,'why can i never seem to say the right thing?' weeps trump into pillow,22234
213,teens spend wild spring break in d.c. begging lawmakers for their lives,45085
214,chuck schumer condemns mitch mcconnell for being way better at this than him,43156
215,alpha male marries tri-delta female,36313
216,"after 40-day search, authorities finally replace missing boy",42140
217,terry jones - could have at least manned up and burned one koran,55187
218,chevron touts green initiative with hybrid-powered oil drilling platforms,29734
219,every family member's birthday now marred by some tragedy,10633
220,girl in park acts like it's no big deal she's wearing bikini,32161
221,this so typical of hemophiliac,50233
222,"'to defeat them, i must become them,' john kerry says while putting on black face mask",5503
223,tragic oscar-night camera malfunction leaves seven critically underpublicized,5247
224,masterpiece cakeshop case declared mistrial after clarence thomas tampers with evidence,18946
225,man cruises by william h. macy's website to check out the latest news,32985
226,alpha male marries tri-delta female,11373
227,hollywood's biggest stars endure long lines at oscars security screening,26777
228,texas governor legalizes previously banned wrestling move,29243
229,london opening ceremonies end with traditional lighting of olympic stadium,31501
230,veteran told what offends him,48864
231,security guard makes passing women feel unsafe,31739
232,every bill reminds congressman of ex-wife,1448
233,shocking 'game of thrones' finale concludes with arrest of 5 million viewers for piracy,27976
234,'bad to the bone' to be used in film,29938
235,"win a $10,000 mall of america dream shooting spree!",24412
236,hillary clinton resumes attacking obama,14769
237,ryan seacrest catches up with 'captain phillips' star maersk alabama on red carpet,39797
238,creepy one-word text message from mom could mean anything,50565
239,"horseconnect, the social network for horses, bought for $1 billion",23657
240,roy moore refusing to withdraw from alabama 13-year-old,50784
241,"honest, hardworking man leans against reliable pickup truck",48988
242,trump asks why kavanaugh accuser didn't just immediately request hush money,43882
243,regular on sandy hook truth forum complaining about recent decline in quality of discussion,2393
244,roy moore under fire for new 'children are my future' ad campaign,34472
245,michigan gop passes legislation rerouting flint drinking water to governor's mansion for incoming democrat,54160
246,australian parliament gathers to discuss dwindling hemsworth reserves,41655
247,obama returns from india with these gross candies for everyone,25611
248,light playing beautifully off eric trump's gums at inaugural ball,23051
249,rhode island votes to move 2008 primary to tomorrow,33689
250,t.g.i. friday's bankrupt after spending billions on priceless americana,43173
251,'what's our best path to 270?' gary johnson asks campaign aides packing up office,10842
252,church member not the same since unsuccessful choir tryout,32011
253,mississippi brings down yet another national average,15346
254,focus groups hated it right up until guy's head got cut off,30962
255,al roker strongly considers retiring from creating the weather,33618
256,bruce springsteen accidentally plays 'big government's stealin' our livelihood' at obama rally,34275
257,pederast judge tries 11-year-old as adult,29393
258,jesse helms treed by coon hounds,38354
259,"earth safe, but for how long?",18517
260,internal affairs investigator disappointed conspiracy doesn't go all the way to the top,13006
261,football fan wears off-season body paint,45337
262,north dakota flooding reminds people of north dakota's existence,25746
263,carl bernstein weeps uncontrollably after learning bob woodward wrote a president book without him,50862
264,drew carey signs 75-year contract to host the price is right,25382
265,dana loesch rethinking loyalties after seeing how much airtime teen activists getting,31629
266,chicago st. patrick's day parade finally lifts ban on snakes,31039
267,hillary clinton resumes attacking obama,42737
268,donna brazile says hillary rodham clinton high palace of the solar order was almost like a cult,2276
269,poll finds 97% of americans don't know who donald trump is,31408
270,more cats made,27796
271,man who didn't get joke acts like he did,52147
272,3 toddlers dredged from chuck e. cheese ball pit,33631
273,fbi shuts down prominent new isis recruitment website,2599
274,heroic broken sewage pipe floods congress with human waste,20883
275,trump slams worldwide jewish conspiracy for not doing more to prevent synagogue shooting,40831
276,airline part of something called 'star alliance',2701
277,westboro baptist church not really sure why they're picketing allan arbus' funeral,39393
278,"larry nassar: 'who among us hasn't made a mistake repeatedly and with wild, shameless abandon?'",44994
279,facebook addresses accusations of silencing conservative voices by deleting barack obama's profile,28770
280,bill cosby announces dates for u.s. college commencement tour,2410
281,every new yorker found murdered,34704
282,al franken: 'i'm deeply sorry for my hilarious actions',52095
283,clinton's lower lip 'very concerned' about albanian crisis,28624
284,palestinian family trapped under rubble thrilled to hear 'gaza' trending on twitter,53900
285,tick scientists confirm 2017 summer will be best on record,18829
286,stack of unread new yorkers celebrates one-year anniversary,14964
287,supreme court upholds bill of rights in 5-4 decision,36381
288,ambassador holding phrasebook 'pretty sure' she just strengthened ties with pakistan,15922
289,steven spielberg claims he dislikes black actors to get out of cannes jury duty,53615
290,fox news problem solvers in way over their heads,52375
291,grasshopper dismembered by future supreme court justice,49410
292,overpopulation of the earth: will it create valuable new markets?,13790
293,emotional el chapo reunited with family following passage of criminal justice reform bill,52680
294,scientists politely remind world that clean energy technology ready to go whenever,15632
295,ivanka trump distraught after learning detained migrant children completely without sewing machines,40502
296,kennel certificate proves who puppy daddy is,12850
297,dad shares photo album through never-before-seen website,9121
298,donna brazile says hillary rodham clinton high palace of the solar order was almost like a cult,35683
299,"liberals return to sodomy, welfare fraud",4115
300,catching up on 2 seasons of 'house of cards' depressingly manageable,17872
301,red cross accused of wartime non-profiteering,20166
302,pandering nobel peace prize committee honors global harmony again,47341
303,taliban agrees to peace deal despite concerns about america's human-rights record,55143
304,$14.5 billion pledged to rebuild battleground states,29379
305,"well known gresham, or musicians form gresham, or supergroup",10213
306,"date of apple backlash set for march 21, 2008",45930
307,'paw patrol' writers defend episode where german shepherd cop shoots unarmed black lab 17 times in back,37887
308,senators wish domenici would bring dog to work more often,45220
309,gop warns refugees likely to be driven to terrorism by way america would treat them,24137
310,concert security guard would willingly give his life to protect coldplay,44773
311,man avoids messing with texas,29099
312,hillary clinton suspended 3 weeks by fec for spitting on volunteer,26962
313,clinton 'very disappointed' in missouri,20218
314,trump's switzerland trip cancelled as president deemed flight risk,12481
315,israeli soldiers open fire on palestinians carrying potentially dangerous injured friends,17053
316,report: most for-profit colleges started in effort to pay off own student debt,50797
317,john kerry jettisons russian henchmen from international space station airlock,49830
318,kerry downs another vodka shot as the last of putin's security detail passes out,46227
319,woman injured in hostile makeover,34165
320,asian man has thing for asian women,49046
321,"gaunt, sickly kirby takes leave of absence from video games following stomach cancer diagnosis",41914
322,friend dishonorably discharged from navigation duties after missing exit,28666
323,the media: are they media-obsessed?,32763
324,christie 2016 comes from nowhere to win republican nomination,11841
325,lie to cover surprise party sounds more fun than surprise party,52143
326,snowstorm in chicago delays hundreds of morning murders,49454
327,local radio station has got some doobie brothers coming up for you,4312
328,airline part of something called 'star alliance',40041
329,golden retriever mauls 5 in huge victory for pitbull apologists,6522
330,follow-up tests confirm president trump's 19 other personalities also perfectly healthy,53405
331,perky optimist brings joy everywhere she leaves,36117
332,white house: 'this is not the geologic era to debate gun control',52049
333,dan aykroyd has aykroyds,44171
334,supreme court upholds bill of rights in 5-4 decision,26412
335,death of sailor in iconic vj-day photo reminds americans of halcyon days when wars still ended,49050
336,"tech is the future, reports local dad",49684
337,topeka mayor now highest-ranking non-indicted republican official,22786
338,recording academy reminds aging musicians to die before december 15 to be included in 2017 grammy tributes,27183
339,dana loesch rethinking loyalties after seeing how much airtime teen activists getting,20340
340,spy world-famous,49237
341,every family member's birthday now marred by some tragedy,36352
342,lady gaga quashes rumors that she ever thought bradley cooper talented in any way,32982
343,gop voters: 'can we see what it looks like with huntsman and perry again?',13178
344,onion social embraces diversity by adding prophet mohammed emoji,42616
345,concert security guard would willingly give his life to protect coldplay,21394
346,cigarette tax hike to pay for iraq war,51200
347,"u.s. indicts 12 russian officials who will be indicted for 2018, 2020 election hacking",28323
