,FN_text,FN_index
348,plows working around clock to keep new hampshire roads clear of campaign signs,1913
349,christianity: is your family at risk?,33026
350,panic floods mike pence's system before realizing hand on knee his own,21681
351,steven spielberg claims he dislikes black actors to get out of cannes jury duty,7529
352,wall street journal lays off 150 stipple-portrait artists,47110
353,ahmadinejad signs on as dean at sarah lawrence,22073
354,dad's been on a parenting kick lately,36999
355,selfish missouri voters reject anti-union law after everything bosses have done for them,44822
356,white house releases moving statement honoring woman who called obama an arab in 2008,50403
357,toddlers debate whether 'dora's explorer girls' canon or expanded universe,39332
358,defiant pelosi begins swimming to afghanistan after trump denies use of government plane,28413
359,unclear if fountain is the type you're allowed to run around in,16092
360,psychic helps police waste valuable time,51297
361,detectives overlooked casey anthony's 'i killed my daughter' ama on reddit,33602
362,dollar losing value against the quarter,16270
363,same jumbotron used for marriage proposal used to ask for divorce,34493
364,"rick perry speech electrifies 1,200 scared, miserable racists",16378
365,americans hopeful this will be last mass shooting before they stop on their own for no reason,14381
366,ticketed motorist pointing finger just the green light cop needed,13730
367,woman probably just made up rape story in order to get threatening emails,27944
368,pope francis washes feet of phillie phanatic,54599
369,"win a $10,000 mall of america dream shooting spree!",45541
370,sgt. bowe bergdahl recaptured by taliban after wandering off texas base,26225
371,andrew w.k. adopts staunch party-advocacy position,14311
372,altruism mocked,17835
373,hundreds of rowdy starship crews disembark in nyc during intergalactic fleet week,49306
374,escalating tensions lead trump to shake up inner circle of tv programs,19407
375,katie couric flirts with cardinal on air,10040
376,secret police enforce mourning of deng xiaoping,18657
377,"tech is the future, reports local dad",836
378,women: why don't they lose some weight?,42015
379,man cruises by william h. macy's website to check out the latest news,17830
380,5-year-old alabama boy misses fun 'bunker grandpa',2830
381,raid on nacho-supremacist compound uncovers guacamole-making materials,16810
382,12-year-old who got her hair curled for spring dance the very image of old hollywood glamour,16043
383,global-warming crisis makes for delightful mid-february afternoon,19395
384,earth explodes,6353
385,kanye west announces his new name is tim,29796
386,kirstjen nielsen reminds herself she a private citizen now after instinctively detaining mexican child on the street,35127
387,plane delay leaves hundreds whiny,7639
388,slain cop had only 37 years until retirement,3959
389,veteran congressman can still remember when inaction on gun violence actually presented a moral dilemma,21920
390,hillary clinton suspended 3 weeks by fec for spitting on volunteer,5246
391,supreme court gets free box of shoes after mentioning nike in ruling,11297
392,wild-eyed marco rubio embarks in rowboat to help venezuela coup effort,33927
393,morale low at state department after only employee fired,3864
394,fans of victorious nobel laureates riot in stockholm,11593
395,"earth safe, but for how long?",41238
396,god shoots himself while cleaning gun,14108
397,scott walker changes locks on wisconsin governor's office,41644
398,"this actually good news, contractor reveals, because now you know the real problem",38445
399,malala can tell oxford paired her with roommate just because they're both nobel laureates,51288
400,mlb season ends over 200 days early after new rules speed up games way too much,4343
401,are we meeting the needs of our nation's rich?,731
402,man can't get police to care about his bob crane murder theory,50481
403,boehner opens another heap of letters from constituents asking to give corporations more tax breaks,17689
404,thai soccer player still waiting for parents to pick him up,30349
405,furloughed bison pour back into national parks after government reopens,8775
406,need for more places to sit becomes election's most important issue,18604
407,color drains from michael flynn's face after single red dahlia drops out of envelope from russian intelligence,20573
408,supreme court justices keep citing cases roberts and alito are too young to remember,25390
409,'bad to the bone' to be used in film,5136
410,woman probably just made up rape story in order to get threatening emails,13845
411,heroic broken sewage pipe floods congress with human waste,34186
412,alabama forced to release thousands of sex offenders after inmates deny charges,8589
413,"'captain actual america' overweight, hopelessly in debt",31411
414,experts say puerto rico still extremely vulnerable to future u.s. government,28925
415,yahoo back on top after purchasing millions of 13-year-old girls' blogs,43320
416,exercise briefly considered,16973
417,radio station playing controversial 'little drummer boy' on repeat in defiance of those who claim it contains sexually predatory themes,54807
418,lone mexican in mexican restaurant doing the dishes,28618
419,'mad men' premiere features group of actors who are scared to death of never making transition to film,7370
420,angela merkel opens up to the only newspaper she trusts,46058
421,controversial theory suggests aliens may have built ancient egypt's intergalactic spaceport,14188
422,explosion used to signify big savings,11776
423,boilermakers protest purdue's mascot,43804
424,chris penn's body double really letting self go,45985
425,"after 40-day search, authorities finally replace missing boy",22683
426,stack of unread new yorkers celebrates one-year anniversary,45715
427,dan quayle on standby to take over as bush family patriarch after george h.w. admitted to icu,20149
428,t.g.i. friday's bankrupt after spending billions on priceless americana,16419
429,john kelly resigns in last-ditch effort to save his and trump's friendship,40335
430,radical islamic extremists snowboard into u.s. embassy,29785
431,what man thinks is recycling takes city workers 2 hours a day to sort,45911
432,fox news problem solvers in way over their heads,147
433,trump slammed for signing john mccain defense bill without praising how many people it will kill,43861
434,"tanned, exquisitely coiffed bernie sanders tells supporters corporations actually have a lot to offer",31712
435,son's black market value checked online,2370
436,newt gingrich: 'it's an honor to address a crowd that shares my utterly bizarre and unhealthy obsession with hillary clinton',21650
437,those we lost in 2011,47879
438,catholic church releases new molestation-proof altar boy uniform,49021
439,state bird reconsidered after latest wren attack,29159
440,missing kazakhstani nukes turn up in manhattan,51426
441,compassionate fisherman doesn't have heart to throw trout back into incredibly polluted lake,6002
442,thousands gather to watch losing incumbents marched out of washington,7173
443,"well known gresham, or musicians form gresham, or supergroup",51751
444,open casket really ruining vibe at funeral,51146
445,trump fulfills campaign promise of pushing major immigration decision on someone else so he can watch tv,41498
446,aaa member pulled first from car crash,35231
447,u.s. adds 4 million jobs but in st. louis,40987
448,vatican policymaking once again manipulated by powerful second commandment rights groups,38843
449,esports star suspected of using peds,38491
450,18-year-old fighting in afghanistan has 9/11 explained to him by older soldier,17459
451,report: countless invasive species detained in epa black sites,3563
452,"danny devito a lot taller, thinner in person",37431
453,special pull-out section: rural illinois' sexist moms,9103
454,earth explodes,54141
455,media suffering through record normal temperatures,48858
456,nobody in ukraine notices absence of government,11052
457,"politician spots young female aide, and so it begins",48736
458,raid on nacho-supremacist compound uncovers guacamole-making materials,27438
459,powerball super fans camping out before the big drawing dressed up as their favorite numbers,25975
460,"gm workers strike for 2,000-peso raise",25618
461,"authorities claim the true austin bomber was everyone who failed this sensitive, promising kid",30558
462,"brilliant, innovative ceo just wrote words 'social media' on whiteboard and underlined it",26669
463,"'secretary clinton is a different person than donald trump,' says bernie sanders in ringing endorsement",21833
